<?xml version="1.0" encoding="UTF-8"?>
<!-- ejm06.xml -->
<!DOCTYPE direccion SYSTEM "ejm06.dtd">
<direccion>
  <nombre>
    <titulo>Mrs.</titulo>
    <nombres>Mary</nombres>
    <apellidos>McGoon</apellidos>
  </nombre>
  <calle>1401 Main Street</calle>
  <ciudad>Anytown</ciudad>
  <estado>NC</estado>
  <codigo-postal>34829</codigo-postal>
</direccion>

